{
  "schema_version": "1.0",
  "workflow_id": "minimal_job",
  "version": 1,
  "pipeline": {
    "understand": "required",
    "reference": "disabled",
    "generate": "required",
    "evaluate": "disabled",
    "refine": "disabled",
    "deliver": "required"
  },
  "step_overrides": {
    "understand": { "cancellable": true },
    "reference": { "cancellable": false },
    "generate": { "cancellable": false },
    "evaluate": { "cancellable": false },
    "refine": { "cancellable": false },
    "deliver": { "cancellable": false }
  },
  "permissions": {
    "trust_level": "T2",
    "activation": "human_required",
    "required_capabilities": ["llm.call"]
  },
  "resource_policy": {
    "max_tokens": 4000,
    "max_execution_time": 60,
    "max_retries": 1
  }
}
